,DOI,Title,Abstract,Date,Journal,catalyst,reactant,Method,Product
78,10.1016/j.jhazmat.2021.125289,Catalytic conversion of plastic wastes using cost-effective bauxite residue as catalyst into H2-rich syngas and magnetic nanocomposites for chrome(VI) detoxification,"Red mud (RM) as bauxite residue from aluminum plant was investigated as cost-effective catalyst for pyrolysis and ex-situ catalytic conversion of plastic wastes into H2-rich syngas and magnetic carbon nanocomposites. The results showed that the introduction of RM catalyst elevated gas yield from 23.8 to 60.3 wt% as a rise of catalytic temperature (700–850 °C), due to its high iron activity for scission of polymer chains. Furthermore, the endothermic nature of cracking reactions of hydrocarbons led to the maximum H2 production of 28.8 mmol g feed − 1 and 63 vol% at 850 °C. The carbon/RM nanocomposites were comprehensively evaluated by multiple characterizations. High-resolution TEM indicated considerable carbon nanotubes(CNTs) depositing on the RM surface that modified iron sites dispersion and diminished nanoparticle size of iron at higher temperature of ≥ 800 °C. XRD and XPS results confirmed that higher temperature provided carbon components surrounding iron species to form metallic iron. The carbon/RMs were initially applied to chromium(VI) removal in sewage. RM-800 delivered high-profile adsorption capacity of 193.8 mg g−1, mainly attributed to the synergistic effect of chemical reduction by sufficient Fe0 exposure and CNTs growth promoting electrostatic attraction and electron transfer capacity. Furthermore, the correlation mechanism between catalytic temperature and the evolution of products and was discussed.",5 July 2021,Journal of Hazardous Materials,"['iron', 'aluminum', 'Fe0']","['plastic wastes', 'polymer chains']","['pyrolysis', 'conversion', 'ex-situ catalytic conversion']","['maximum H2 production', 'products']"
79,10.1016/j.ijhydene.2020.06.128,Ni–Pt/Al nano-sized catalyst supported on TNPs for hydrogen and valuable fuel production from the steam reforming of plastic waste dissolved in phenol,"In this research, titanium nanoparticles (TNPs) for Ni–Pt/Al nano-sized catalysts were prepared via the hydrothermal technique, and their catalytic performance for the polyethylene terephthalate (PET) as plastic waste and phenol steam reforming reaction was examined. Complementary characterization methods, such as BET, ICP, TEM, XRD, FTIR, NH3-TPD, H2-TPR, CO2-TPD, TGA, and CHNS, were conducted to relate surface functionality and structure to the activity of catalysts. The catalytic activity and stability with ten days on stream at 700 °C were investigated. It was found that the catalyst properties such as surface area and the number of acid sites play a crucial role in catalyst activity. The feed conversion and hydrogen yield for the optimum catalyst that is Ni–Pt/Ti–Al were found to be 92% and 75%, respectively. This research has also emphasized the opportunities of this method to resolve the threat of PET plastic waste to the environment concerning the creation of valuable fuels such as benzene, toluene, styrene, methylindene, etc.",3 September 2020,International Journal of Hydrogen Energy,"['Ni–Pt/Al', '–Pt/Ti', 'Ni', 'Al', 'titanium']","['polyethylene terephthalate', 'plastic waste', 'PET plastic waste']","['reforming', 'phenol steam reforming reaction', 'thermal', 'hydrothermal technique', 'The feed conversion', 'conversion']",['styrene']
80,10.1016/j.egypro.2014.01.212,Fuel Oil Production from Municipal Plastic Wastes in Sequential Pyrolysis and Catalytic Reforming Reactors,"The aim of this research was to study fuel oil production from municipal plastic wastes by sequential pyrolysis and catalytic reforming processes. Three kinds of municipal plastic wastes were collected from the final disposal site and the small recycling company in Yogyakarta city, Indonesia. Commercial Y-zeolite and natural zeolite catalysts were used in this study. The results show that the feedstock types strongly affect the product yields and the quality of liquid and solid products. HDPE waste produced the highest liquid fraction. The catalyst presences reduced the liquid fraction and increased the gaseous fraction. Furthermore, municipal plastic wastes pyrolysis produced higher heating value solid products than those of biomass and low rank coal.",2014,Energy Procedia,"['Y-zeolite', 'zeolite']","['municipal plastic wastes', 'HDPE waste', 'municipal plastic']","['pyrolysis', 'sequential pyrolysis', 'reforming', 'catalytic reforming processes']","['fuel oil production', 'product yields', 'liquid solid products', 'higher heating value solid products']"
81,10.1016/j.wasman.2014.08.014,Pyrolysis and catalytic pyrolysis as a recycling method of waste CDs originating from polycarbonate and HIPS,"Pyrolysis appears to be a promising recycling process since it could convert the disposed polymers to hydrocarbon based fuels or various useful chemicals. In the current study, two model polymers found in WEEEs, namely polycarbonate (PC) and high impact polystyrene (HIPS) and their counterparts found in waste commercial Compact Discs (CDs) were pyrolysed in a bench scale reactor. Both, thermal pyrolysis and pyrolysis in the presence of two catalytic materials (basic MgO and acidic ZSM-5 zeolite) was performed for all four types of polymers. Results have shown significant recovery of the monomers and valuable chemicals (phenols in the case of PC and aromatic hydrocarbons in the case of HIPS), while catalysts seem to decrease the selectivity towards the monomers and enhance the selectivity towards other desirable compounds.",December 2014,Waste Management,"['zeolite', 'MgO']","['disposed polymers', 'model polymers', 'waste commercial Compact Discs', 'polymers']","['thermal pyrolysis', 'pyrolysis', 'thermal']",['monomers']
82,10.1016/j.wasman.2015.12.024,Waste-to-energy: Dehalogenation of plastic-containing wastes,"The dehalogenation measurements could be carried out with the decomposition of plastic wastes simultaneously or successively. This paper reviewed the progresses in dehalogenation followed by thermochemical conversion of plastic-containing wastes for clean energy production. The pre-treatment method of MCT or HTT can eliminate the halogen in plastic wastes. The additives such as alkali-based metal oxides (e.g., CaO, NaOH), iron powders and minerals (e.g., quartz) can work as reaction mediums and accelerators with the objective of enhancing the mechanochemical reaction. The dehalogenation of waste plastics could be achieved by co-grinding with sustainable additives such as bio-wastes (e.g., rice husk), recyclable minerals (e.g., red mud) via MCT for solid fuels production. Interestingly, the solid fuel properties (e.g., particle size) could be significantly improved by HTT in addition with lignocellulosic biomass. Furthermore, the halogenated compounds in downstream thermal process could be eliminated by using catalysts and adsorbents. Most dehalogenation of plastic wastes primarily focuses on the transformation of organic halogen into inorganic halogen in terms of halogen hydrides or salts. The integrated process of MCT or HTT with the catalytic thermal decomposition is a promising way for clean energy production. The low-cost additives (e.g., red mud) used in the pre-treatment by MCT or HTT lead to a considerable synergistic effects including catalytic effect contributing to the follow-up thermal decomposition.",March 2016,Waste Management,"['quartz', 'CaO', 'iron']","['plastic wastes', 'plastic-containing wastes', 'waste plastics', 'wastes']","['conversion', 'thermochemical conversion', 'chemical conversion', 'thermal', 'downstream thermal process', 'catalytic thermal decomposition', 'follow-up thermal decomposition']","['clean energy production', 'solid fuels production']"
83,10.1016/j.wasman.2015.12.024,Waste-to-energy: Dehalogenation of plastic-containing wastes,"The dehalogenation measurements could be carried out with the decomposition of plastic wastes simultaneously or successively. This paper reviewed the progresses in dehalogenation followed by thermochemical conversion of plastic-containing wastes for clean energy production. The pre-treatment method of MCT or HTT can eliminate the halogen in plastic wastes. The additives such as alkali-based metal oxides (e.g., CaO, NaOH), iron powders and minerals (e.g., quartz) can work as reaction mediums and accelerators with the objective of enhancing the mechanochemical reaction. The dehalogenation of waste plastics could be achieved by co-grinding with sustainable additives such as bio-wastes (e.g., rice husk), recyclable minerals (e.g., red mud) via MCT for solid fuels production. Interestingly, the solid fuel properties (e.g., particle size) could be significantly improved by HTT in addition with lignocellulosic biomass. Furthermore, the halogenated compounds in downstream thermal process could be eliminated by using catalysts and adsorbents. Most dehalogenation of plastic wastes primarily focuses on the transformation of organic halogen into inorganic halogen in terms of halogen hydrides or salts. The integrated process of MCT or HTT with the catalytic thermal decomposition is a promising way for clean energy production. The low-cost additives (e.g., red mud) used in the pre-treatment by MCT or HTT lead to a considerable synergistic effects including catalytic effect contributing to the follow-up thermal decomposition.",March 2016,Waste Management,"['quartz', 'CaO', 'iron']","['plastic wastes', 'plastic-containing wastes', 'waste plastics', 'wastes']","['conversion', 'thermochemical conversion', 'chemical conversion', 'thermal', 'downstream thermal process', 'catalytic thermal decomposition', 'follow-up thermal decomposition']","['clean energy production', 'solid fuels production']"
84,10.1016/j.apcata.2022.118936,Alcoholysis of waste PLA-based plastics to methyl lactate over sulfated ZrO2/SiO2 catalyst,"Polylactic acid (PLA) is popularly used to replace some petroleum-based polymers due to its biodegradability. However, biodegradation of waste PLA requires specific bacteria, stringent conditions and long time. Catalytic recycling of waste PLA to valuable added products rather than composting is a sustainable green routine. In this work, catalytic alcoholysis of waste PLA to methyl lactate (MLA) was carried out over a SiO2 @UiO-66 derived solid acid (SO2– 4/ZrO2/SiO2). Characterizations indicated that SO2– 4/ZrO2/SiO2 processed large surface area and homogenously dispersed acid sites, and it exhibited excellent performance for the alcoholysis of waste PLA under mild conditions. At 140 oC, the yield of MLA is 92.7% within 5 h, and SO2– 4/ZrO2/SiO2 could be recycled at least five times without obvious loss of activity. The specific yield of MLA over SO2– 4/ZrO2/SiO2 reached 2678 mg-MLA/g-cat/h, which was higher than that of H3PW12O40, Amberlyst-45, Hβ, HZSM-5 and α-ZrP. At the same time, SO2– 4/ZrO2/SiO2 was also capable of the alcoholysis of waste PLA-based products. A possible pathway of PLA alcoholysis over SO2– 4/ZrO2/SiO2 catalyst was proposed.",5 January 2023,Applied Catalysis A: General,"['4/ZrO2/SiO2', '/SiO2', 'H3PW12O40']","['petroleum-based polymers', 'waste PLA', 'waste PLA-based products']","['biodegradation', 'degradation']","['valuable added products', 'waste PLA-based products']"
85,10.1016/j.fuel.2021.121440,Drop-in fuel production with plastic waste pyrolysis oil over catalytic separation,"The catalytic upgrading of plastic pyrolysis oil was conducted in a 2-kg-scale pyrolysis oil separation system with or without zeolite 4A, Cu-based (MDC-7) and Ni-based catalysts to produce light (F1), middle (F2) and heavy (F3) oil fractions. From the preliminary separation tests without a catalyst, the separation vapor temperature for diesel-like middle fraction (C11 - C22) was determined to be in the range of 107–305 °C. After the pyrolysis oil separation with catalysts, the heavy carbon range (>C23) sharply decreased from 22.1 wt% in the crude plastic pyrolysis oil to 0.1–1.6 wt% and 7.3–8.4 wt% in the F1 and F2, respectively. Among three catalysts, Ni-based catalyst exhibited the highest deoxygenation capacity (1.23% O in F1 and 0.3% O in F2) owing to its strong acid sites concentration (1.115 mmol/g). Accordingly, the order of the deoxygenation capacity was Ni-based > MDC-7 > zeolite 4A > no catalyst. Moreover, the catalytic reactions (deoxygenation) and coke formation mainly occurred on the strong acid sites. MDC-7 catalyst contributed to more production of C6–C10 range (15.8 %) with aromatic and naphthenic compounds. In contrast, the major catalytic mechanisms of Ni-based catalyst were dehydration, decarboxylation and decarbonylation reactions. In addition, the physical properties of catalytically upgraded pyrolysis oil were close to those of the petroleum-based fuels. Finally, the current study suggested that Ni-based catalyst was a suitable catalyst for the production of diesel-like fraction (C11-C12) with the lowest contents of oxygen from the plastic pyrolysis oil.",1 December 2021,Fuel,['Ni-based'],"['plastic pyrolysis oil', 'crude plastic pyrolysis oil', 'plastic pyrolysis oil']","['pyrolysis', 'plastic pyrolysis oil', '2-kg-scale pyrolysis oil separation', 'pyrolysis oil separation', 'crude plastic pyrolysis oil', 'catalytically upgraded pyrolysis oil', 'plastic pyrolysis oil']","['plastic pyrolysis oil', '2-kg-scale pyrolysis oil separation', 'heavy (F3) oil fractions', 'pyrolysis oil separation', 'crude plastic pyrolysis oil', 'production', 'catalytically upgraded pyrolysis oil', 'production', 'plastic pyrolysis oil']"
86,10.1016/j.polymdegradstab.2022.110168,Efficient glycolysis of recycling poly(ethylene terephthalate) via combination of organocatalyst and metal salt,"The recycling of discarded polyethylene terephthalate (PET) is an effective way of catering to global sustainable economic development strategies. It is well known that catalysts play a crucial role in the degradation of PET, based on the fact that most of the currently available catalysts have some disadvantages, including complex preparation process, severe reaction conditions and insufficient reaction efficiency. Herein, we report a combination of metal catalyst and organoazacyclic 1,8-diazabicyclo [5.4.0]undec-7-ene (DBU) as cooperating catalysts were used to depolymerize waste polyethylene terephthalate into bis(2-hydroxyethyl) terephthalate (BHET) directly. Screening of several metal salts under optimal conditions showed that zinc acetate ((Zn(OAc)2) was the most effective co-catalyst. The waste PET could be completely depolymerized at 180 °C for 77 min with the weight ratio of EG/PET was 3:1 and the molar ratio of Zn(OAc)2/DBU was 1:2, and the content of BHET in the recrystallized product reached 78.2%. Kinetic studies showed that the activation energy of depolymerization of PET was 115.48 kJ/mol. It was speculated that the hydrogen bond formed by Zn(OAc)2/DBU and EG exhibited excellent catalytic effect in the glycolysis process. Therefore, it is hopeful that this simple and mild composite catalyst can provide industrial ideas for recycling other waste polyesters.",December 2022,Polymer Degradation and Stability,"['DBU', '2/DBU']","['discarded polyethylene terephthalate', 'waste polyethylene', 'The waste PET', 'depolymerization', 'waste polyesters']","['degradation', 'degradation', 'depolymerization', 'glycolysis', 'glycolysis process']","['(BHET', 'BHET', 'recrystallized product', 'activation energy']"
87,10.1016/j.apcata.2022.118936,Alcoholysis of waste PLA-based plastics to methyl lactate over sulfated ZrO2/SiO2 catalyst,"Polylactic acid (PLA) is popularly used to replace some petroleum-based polymers due to its biodegradability. However, biodegradation of waste PLA requires specific bacteria, stringent conditions and long time. Catalytic recycling of waste PLA to valuable added products rather than composting is a sustainable green routine. In this work, catalytic alcoholysis of waste PLA to methyl lactate (MLA) was carried out over a SiO2 @UiO-66 derived solid acid (SO2– 4/ZrO2/SiO2). Characterizations indicated that SO2– 4/ZrO2/SiO2 processed large surface area and homogenously dispersed acid sites, and it exhibited excellent performance for the alcoholysis of waste PLA under mild conditions. At 140 oC, the yield of MLA is 92.7% within 5 h, and SO2– 4/ZrO2/SiO2 could be recycled at least five times without obvious loss of activity. The specific yield of MLA over SO2– 4/ZrO2/SiO2 reached 2678 mg-MLA/g-cat/h, which was higher than that of H3PW12O40, Amberlyst-45, Hβ, HZSM-5 and α-ZrP. At the same time, SO2– 4/ZrO2/SiO2 was also capable of the alcoholysis of waste PLA-based products. A possible pathway of PLA alcoholysis over SO2– 4/ZrO2/SiO2 catalyst was proposed.",5 January 2023,Applied Catalysis A: General,"['4/ZrO2/SiO2', '/SiO2', 'H3PW12O40']","['petroleum-based polymers', 'waste PLA', 'waste PLA-based products']","['biodegradation', 'degradation']","['valuable added products', 'waste PLA-based products']"
88,10.1016/j.fuel.2021.121440,Drop-in fuel production with plastic waste pyrolysis oil over catalytic separation,"The catalytic upgrading of plastic pyrolysis oil was conducted in a 2-kg-scale pyrolysis oil separation system with or without zeolite 4A, Cu-based (MDC-7) and Ni-based catalysts to produce light (F1), middle (F2) and heavy (F3) oil fractions. From the preliminary separation tests without a catalyst, the separation vapor temperature for diesel-like middle fraction (C11 - C22) was determined to be in the range of 107–305 °C. After the pyrolysis oil separation with catalysts, the heavy carbon range (>C23) sharply decreased from 22.1 wt% in the crude plastic pyrolysis oil to 0.1–1.6 wt% and 7.3–8.4 wt% in the F1 and F2, respectively. Among three catalysts, Ni-based catalyst exhibited the highest deoxygenation capacity (1.23% O in F1 and 0.3% O in F2) owing to its strong acid sites concentration (1.115 mmol/g). Accordingly, the order of the deoxygenation capacity was Ni-based > MDC-7 > zeolite 4A > no catalyst. Moreover, the catalytic reactions (deoxygenation) and coke formation mainly occurred on the strong acid sites. MDC-7 catalyst contributed to more production of C6–C10 range (15.8 %) with aromatic and naphthenic compounds. In contrast, the major catalytic mechanisms of Ni-based catalyst were dehydration, decarboxylation and decarbonylation reactions. In addition, the physical properties of catalytically upgraded pyrolysis oil were close to those of the petroleum-based fuels. Finally, the current study suggested that Ni-based catalyst was a suitable catalyst for the production of diesel-like fraction (C11-C12) with the lowest contents of oxygen from the plastic pyrolysis oil.",1 December 2021,Fuel,['Ni-based'],"['plastic pyrolysis oil', 'crude plastic pyrolysis oil', 'plastic pyrolysis oil']","['pyrolysis', 'plastic pyrolysis oil', '2-kg-scale pyrolysis oil separation', 'pyrolysis oil separation', 'crude plastic pyrolysis oil', 'catalytically upgraded pyrolysis oil', 'plastic pyrolysis oil']","['plastic pyrolysis oil', '2-kg-scale pyrolysis oil separation', 'heavy (F3) oil fractions', 'pyrolysis oil separation', 'crude plastic pyrolysis oil', 'production', 'catalytically upgraded pyrolysis oil', 'production', 'plastic pyrolysis oil']"
89,10.1016/j.polymdegradstab.2022.110168,Efficient glycolysis of recycling poly(ethylene terephthalate) via combination of organocatalyst and metal salt,"The recycling of discarded polyethylene terephthalate (PET) is an effective way of catering to global sustainable economic development strategies. It is well known that catalysts play a crucial role in the degradation of PET, based on the fact that most of the currently available catalysts have some disadvantages, including complex preparation process, severe reaction conditions and insufficient reaction efficiency. Herein, we report a combination of metal catalyst and organoazacyclic 1,8-diazabicyclo [5.4.0]undec-7-ene (DBU) as cooperating catalysts were used to depolymerize waste polyethylene terephthalate into bis(2-hydroxyethyl) terephthalate (BHET) directly. Screening of several metal salts under optimal conditions showed that zinc acetate ((Zn(OAc)2) was the most effective co-catalyst. The waste PET could be completely depolymerized at 180 °C for 77 min with the weight ratio of EG/PET was 3:1 and the molar ratio of Zn(OAc)2/DBU was 1:2, and the content of BHET in the recrystallized product reached 78.2%. Kinetic studies showed that the activation energy of depolymerization of PET was 115.48 kJ/mol. It was speculated that the hydrogen bond formed by Zn(OAc)2/DBU and EG exhibited excellent catalytic effect in the glycolysis process. Therefore, it is hopeful that this simple and mild composite catalyst can provide industrial ideas for recycling other waste polyesters.",December 2022,Polymer Degradation and Stability,"['DBU', '2/DBU']","['discarded polyethylene terephthalate', 'waste polyethylene', 'The waste PET', 'depolymerization', 'waste polyesters']","['degradation', 'degradation', 'depolymerization', 'glycolysis', 'glycolysis process']","['(BHET', 'BHET', 'recrystallized product', 'activation energy']"
90,10.1016/j.jece.2022.108622,SolvX: Solvothermal conversion of mixed waste plastics in supercritical toluene in presence of Pd/C catalyst,"As the world's ability to cope with the fast-rising output of disposable plastic products is limited, plastic pollution has emerged as one of the most important environmental challenges. Catalytic solvothermal conversion (SolvX) could potentially utilize mixed waste plastics (MWPs) for sustainable fuels and chemical production. In this study, the effect of SolvX reaction time (1 – 5 h), Pd/C catalyst loading (0 – 10 wt%), and hydrogen loading (0–75 bar) on MWPs were investigated using supercritical toluene as solvent at temperature 350 °C. Four major waste plastics including low-density polyethylene (#4), polypropylene (#5), polystyrene (#6), and polyurethane (#7) were used as feedstock for this study. Along with SolvX conversion, the liquid products (crude oils) were characterized for elemental composition changes using ultimate analysis, boiling point distribution via thermogravimetric analysis, functional groups alteration using Fourier transform infrared spectroscopy, and product identification via gas chromatography-mass spectrometry. The results showed that the addition of catalyst and hydrogen have positive effects on the SolvX conversion. According to the elemental analysis, the SolvX crude oils' higher heating values (HHV) range from 32 to 38 MJ/Kg. The range of boiling points demonstrates that Pd/C increases the formation of lighter hydrocarbons. Additionally, a proposed catalytic SolvX reaction mechanism shows that the aromaticity raised with the increment of residence time and Pd/C enhances hydrodenitrogenation and deoxygenation at higher hydrogen loading.",December 2022,Journal of Environmental Chemical Engineering,['Pd/C'],"['disposable plastic products', 'plastic pollution', 'mixed waste plastics', 'Four major waste plastics', 'low-density polyethylene', 'polypropylene', 'polyurethane']","['Catalytic solvothermal conversion', 'conversion', 'thermal', 'SolvX conversion', 'SolvX conversion']","['disposable plastic products', 'chemical production', 'liquid products', 'product identification', 'crude oils', ""SolvX crude oils' higher heating values"", 'boiling points']"
91,10.1016/j.apcatb.2022.122279,Facile synthesis of precious metal-free Ti-Cu nano-catalyst for enhanced hydrogen and liquid fuels production from in-situ pyrolysis-catalytic steam reforming reaction of polystyrene waste dissolved in phenol,"In-situ pyrolysis-catalytic steam reforming reaction of polystyrene waste (PSW) liquefied in phenol can generate hydrogen from phenol and valuable liquid fuel from the PSW and thus has been studied recently. However, due to the complexity of phenol compounds and plastic waste, this reaction suffers from high energy consumption and coking. Herein, Ti, 4Ti3Cu and 3Ti3Cu nano-catalysts were facilitatively prepared using hydrothermal and impregnation methods and the physical and chemical properties of the fresh and used samples were deeply characterized. The experimental results show that almost complete phenol conversion with 97.90% H2 yield was achieved at 800 oC using 3Ti3Cu nano-catalyst. The catalytic pyrolysis products were ethylamine, tert-butyl hydroperoxide (TBHP) and benzene (1,1-dimethylethoxy) (BDE). The correspondence of the preparation, morphology and catalytic activity in this research elucidates the synthesis of anti-coking and stable nano-catalysts for in-situ pyrolysis-catalytic steam reforming reaction.",15 May 2023,Applied Catalysis B: Environmental,"['TBHP', 'Ti', '4Ti3Cu', '3Ti3Cu']","['polystyrene waste', 'plastic waste']","['pyrolysis', 'reforming', 'thermal', 'hydrothermal impregnation methods', 'conversion', 'complete phenol conversion', 'The catalytic pyrolysis products']","['polystyrene waste', 'high energy consumption', 'The catalytic pyrolysis products']"
