,DOI,Title,Abstract,Date,Journal,catalyst,reactant,Method,Product
105,10.1016/j.jaap.2022.105831,Pyrolysis of waste plastics-derived carbon nanomaterials on nickel foam for utilization as an efficient binder-free electrode: Effect of catalyst loading on capacitive performance,"The pyrolytic liquid and gas products are extensively analyzed for practical applications, but, few applications exist for solid product from waste plastics pyrolysis. This study investigates energy storage potential of waste plastics-derived carbon nano-materials (CNMs), pyrolyzed directly on nickel foam (NF) coated with nickel alumina catalyst, in a two-stage fixed bed reactor. Effect of increasing nickel to aluminum molar ratio (0.05, 0.1, 0.2) in energy storage capacity is studied. Galvanostatic charge-discharge curves, at 0.125 A g−1, show highest specific capacitance of 153.75 F g−1 for 0.1 molar ratio. The reason for such high performance is mainly because of a) greater metal-support interaction by using NF substrate, b) formation of CNMs according to base-growth mechanism, providing metal free surface at the top, and c) the presence of equal amounts of disordered and ordered carbons, resulting in meso- and micro-porous structures, providing high electrolyte availability at the electrode surface. The retained rectangle shape of cyclic voltammetry (CV) curve after 5000 cycles, with 98.5 % capacitance retention, also exhibits stability and durability of produced electrode. Though the fabricated electrode involved no post-treatment, yet, it showed higher performance than commercial CNMs. Therefore, this study open new ways to fabricate environment friendly and economically effective supercapacitors.",January 2023,Journal of Analytical and Applied Pyrolysis,['nickel'],"['waste plastics pyrolysis', 'waste plastics-derived carbon nano-materials (CNMs']","['pyrolysis', 'waste plastics pyrolysis']","['The pyrolytic liquid gas products', 'solid product', 'energy storage potential', 'energy storage capacity']"
106,10.1016/j.cej.2022.138603,CO2-mediated thermal treatment of disposable plastic food containers,"In accordance with global economic prosperity, the frequencies of food delivery and takeout orders have been increasing. The pandemic life, specifically arising from COVID-19, rapidly expanded the food delivery service. Thus, the massive generation of disposable plastic food containers has become significant environmental problems. Establishing a sustainable disposal platform for plastic packaging waste (PPW) of food delivery containers has intrigued particular interest. To comprise this grand challenge, a reliable thermal disposable platform has been suggested in this study. From the pyrolysis process, a heterogeneous plastic mixture of PPW was converted into syngas and value-added hydrocarbons (HCs). PPW collected from five different restaurants consisted of polypropylene (36.9 wt%), polyethylene (10.5 wt%), polyethylene terephthalate (18.1 wt%), polystyrene (13.5 wt%), polyvinyl chloride (4.2 wt%), and other composites (16.8 wt%). Due to these compositional complexities, pyrolysis of PPW led to formations of a variety of benzene derivatives and aliphatic HCs. Adapting multi-stage pyrolysis, the different chemicals were converted into industrial chemicals (benzene, toluene, styrene, etc.). To selectively convert HCs into syngas (H2 and CO), catalytic pyrolysis was adapted using supported Ni catalyst (5 wt% Ni/SiO2). Over Ni catalyst, H2 was produced as a main product due to CH bond scission of HCs. When CO2 was used as a co-reactant, HCs were further transformed to H2 and CO through the chemical reactions of CO2 with gas phase HCs. CO2-assisted catalytic pyrolysis also retarded catalyst deactivation inhibiting coke deposition on Ni catalyst.",1 January 2023,Chemical Engineering Journal,"['Ni/SiO2', 'Ni']","['disposable plastic food containers', 'plastic packaging waste', 'heterogeneous plastic mixture', 'polypropylene', 'polyethylene', 'polyethylene terephthalate', 'polystyrene', 'polyvinyl chloride']","['thermal', 'reliable thermal disposable platform', 'pyrolysis process', 'pyrolysis', 'multi-stage pyrolysis', 'catalytic pyrolysis', 'CO2-assisted catalytic pyrolysis']","['disposable plastic food containers', 'value-added hydrocarbons', 'polystyrene', 'styrene', 'main product']"
107,10.1016/j.cej.2022.138603,CO2-mediated thermal treatment of disposable plastic food containers,"In accordance with global economic prosperity, the frequencies of food delivery and takeout orders have been increasing. The pandemic life, specifically arising from COVID-19, rapidly expanded the food delivery service. Thus, the massive generation of disposable plastic food containers has become significant environmental problems. Establishing a sustainable disposal platform for plastic packaging waste (PPW) of food delivery containers has intrigued particular interest. To comprise this grand challenge, a reliable thermal disposable platform has been suggested in this study. From the pyrolysis process, a heterogeneous plastic mixture of PPW was converted into syngas and value-added hydrocarbons (HCs). PPW collected from five different restaurants consisted of polypropylene (36.9 wt%), polyethylene (10.5 wt%), polyethylene terephthalate (18.1 wt%), polystyrene (13.5 wt%), polyvinyl chloride (4.2 wt%), and other composites (16.8 wt%). Due to these compositional complexities, pyrolysis of PPW led to formations of a variety of benzene derivatives and aliphatic HCs. Adapting multi-stage pyrolysis, the different chemicals were converted into industrial chemicals (benzene, toluene, styrene, etc.). To selectively convert HCs into syngas (H2 and CO), catalytic pyrolysis was adapted using supported Ni catalyst (5 wt% Ni/SiO2). Over Ni catalyst, H2 was produced as a main product due to CH bond scission of HCs. When CO2 was used as a co-reactant, HCs were further transformed to H2 and CO through the chemical reactions of CO2 with gas phase HCs. CO2-assisted catalytic pyrolysis also retarded catalyst deactivation inhibiting coke deposition on Ni catalyst.",1 January 2023,Chemical Engineering Journal,"['Ni/SiO2', 'Ni']","['disposable plastic food containers', 'plastic packaging waste', 'heterogeneous plastic mixture', 'polypropylene', 'polyethylene', 'polyethylene terephthalate', 'polystyrene', 'polyvinyl chloride']","['thermal', 'reliable thermal disposable platform', 'pyrolysis process', 'pyrolysis', 'multi-stage pyrolysis', 'catalytic pyrolysis', 'CO2-assisted catalytic pyrolysis']","['disposable plastic food containers', 'value-added hydrocarbons', 'polystyrene', 'styrene', 'main product']"
108,10.1016/j.jenvman.2020.110741,Thermo-catalytic co-pyrolysis of waste plastic and paper in batch and tubular reactors for in-situ product improvement,"In this study, a mixture of waste plastics and papers were pyrolyzed under mild conditions in batch and tubular reactors. The decomposition reactions were enhanced by the use of synthetic zeolite-based catalysts to obtain a higher yield of volatiles and modifying the product composition. Especially the decomposition reactions and the product properties obtained from the different reactors were compared. Gases were analysed by GC-FID and GC-TCD. This fraction contains hydrogen, carbon-monoxide, carbon-dioxide and hydrocarbons. The pyrolysis oils have oxygen-containing compounds, such as alcohols, aldehyde, ketones, carboxylic acids or phenol and its derivative. Not only the reactor configurations but also the catalysts had an effect to the product properties, because the catalysts with alkali characters showed advanced behaviour in the reduction of oxygenated hydrocarbons, while high synthetic zeolite catalysts can increase the saturation and isomerization reactions. The long-term behaviour of the pyrolysis oils was followed by an accelerated aging test at 80 °C till 7 days. The catalysts can effectively reduce the rate of density and viscosity increase during the aging and the alkali catalysts showed beneficial properties in reducing the acidic components. In general, the aging properties were more favorable for pyrolysis oils obtained from the tubular reactor compared with the results in batch reactor.",1 September 2020,Journal of Environmental Management,"['zeolite-based', 'zeolite']",['waste plastics'],"['The pyrolysis oils', 'pyrolysis', 'pyrolysis oils', 'pyrolysis oils']","['product composition', 'product properties', 'The pyrolysis oils', 'pyrolysis oils', 'pyrolysis oils']"
109,10.1016/j.jenvman.2020.110741,Thermo-catalytic co-pyrolysis of waste plastic and paper in batch and tubular reactors for in-situ product improvement,"In this study, a mixture of waste plastics and papers were pyrolyzed under mild conditions in batch and tubular reactors. The decomposition reactions were enhanced by the use of synthetic zeolite-based catalysts to obtain a higher yield of volatiles and modifying the product composition. Especially the decomposition reactions and the product properties obtained from the different reactors were compared. Gases were analysed by GC-FID and GC-TCD. This fraction contains hydrogen, carbon-monoxide, carbon-dioxide and hydrocarbons. The pyrolysis oils have oxygen-containing compounds, such as alcohols, aldehyde, ketones, carboxylic acids or phenol and its derivative. Not only the reactor configurations but also the catalysts had an effect to the product properties, because the catalysts with alkali characters showed advanced behaviour in the reduction of oxygenated hydrocarbons, while high synthetic zeolite catalysts can increase the saturation and isomerization reactions. The long-term behaviour of the pyrolysis oils was followed by an accelerated aging test at 80 °C till 7 days. The catalysts can effectively reduce the rate of density and viscosity increase during the aging and the alkali catalysts showed beneficial properties in reducing the acidic components. In general, the aging properties were more favorable for pyrolysis oils obtained from the tubular reactor compared with the results in batch reactor.",1 September 2020,Journal of Environmental Management,"['zeolite-based', 'zeolite']",['waste plastics'],"['The pyrolysis oils', 'pyrolysis', 'pyrolysis oils', 'pyrolysis oils']","['product composition', 'product properties', 'The pyrolysis oils', 'pyrolysis oils', 'pyrolysis oils']"
110,10.1016/j.jece.2021.106649,Revealing the unexplored effect of residual iron oxide on the photoreforming activities of polypyrrole nanostructures on plastic waste and photocatalytic pollutant degradation,"Nanostructured conducting conjugated polymer, polypyrrole was synthesized via a template free approach. Residual α-Fe2O3 was found in the polypyrrole matrix when FeCl3 was used as the oxidant for polymerization of pyrrole. Importantly, the α-Fe2O3 exists in polypyrrole as nanoparticles forming a heterojunction nanocomposite that significantly improves the photocatalytic activity of the polymer under visible light. Photocatalytic activity of the nanocomposite was multifold higher than metal free polypyrrole and α-Fe2O3. The nanocomposite showed high photocatalytic activity in photoreforming of plastic to hydrogen and other value-added organic products. Furthermore, the photoreforming does not produce any greenhouse gases like CO2. Using the method reported herein, the amount of residual α-Fe2O3 in conducting polymer matrix can be tuned and optimized to yield promising photocatalysts for green and sustainable development.",April 2022,Journal of Environmental Chemical Engineering,['FeCl3'],"['conjugated polymer', 'polypyrrole', 'polypyrrole matrix', 'polymerization', 'polymer', 'metal free polypyrrole', 'plastic', 'polymer matrix']","['reforming', 'photoreforming', 'photoreforming']",['value-added organic products']
111,10.1016/j.jece.2021.106649,Revealing the unexplored effect of residual iron oxide on the photoreforming activities of polypyrrole nanostructures on plastic waste and photocatalytic pollutant degradation,"Nanostructured conducting conjugated polymer, polypyrrole was synthesized via a template free approach. Residual α-Fe2O3 was found in the polypyrrole matrix when FeCl3 was used as the oxidant for polymerization of pyrrole. Importantly, the α-Fe2O3 exists in polypyrrole as nanoparticles forming a heterojunction nanocomposite that significantly improves the photocatalytic activity of the polymer under visible light. Photocatalytic activity of the nanocomposite was multifold higher than metal free polypyrrole and α-Fe2O3. The nanocomposite showed high photocatalytic activity in photoreforming of plastic to hydrogen and other value-added organic products. Furthermore, the photoreforming does not produce any greenhouse gases like CO2. Using the method reported herein, the amount of residual α-Fe2O3 in conducting polymer matrix can be tuned and optimized to yield promising photocatalysts for green and sustainable development.",April 2022,Journal of Environmental Chemical Engineering,['FeCl3'],"['conjugated polymer', 'polypyrrole', 'polypyrrole matrix', 'polymerization', 'polymer', 'metal free polypyrrole', 'plastic', 'polymer matrix']","['reforming', 'photoreforming', 'photoreforming']",['value-added organic products']
112,10.1016/j.proci.2022.06.008,Distinguishing the impact of temperature on iron catalyst during the catalytic-pyrolysis of waste polypropylene,"The catalytic pyrolysis of waste plastics with iron-based catalyst can produce H2 rich gas, liquid oil and carbon nanotube (CNTs) together. While the catalytic pyrolysis mechanism is still unclear, in this study, the catalytic pyrolysis of polypropylene (PP) was explored in depth, and the influence of catalyst and temperature was distinguished. The results indicated that a lower temperature led to the generation of waxes, while a higher temperature promoted the formation of aromatic hydrocarbons when plastic pyrolysis was performed without a catalyst. In addition, a large number of carbon deposits, mainly in the form of spheres, were collected when the temperature was over 800 ℃. These carbon spheres originated from the agglomeration of aromatic hydrocarbons. Once catalysts were introduced, a large amount of liquid oil was transferred into carbon deposits at both lower and higher catalytic temperatures, simultaneously, leading to more light gases releasing, like hydrogen. At a lower temperature (≤ 800 ℃), it was mainly CNTs while carbon spheres are the main solid product at higher temperatures (> 800 ℃). In addition, two different mechanisms of CNTs formation were also concluded that the base-growth model dominated the of generation CNTs at 600 °C whereas the CNTs followed the tip-growth model at 800 ℃. The results show that the optimized temperature for the catalytic process should be around 800 o℃ where approximately 35 mmol/gplastic hydrogen, 50% hydrogen efficiency and over 320 mg/gplastic carbon nanotubes (CNTs) were obtained.",Available online 6 July 2022,Proceedings of the Combustion Institute,['iron-based'],"['waste plastics', 'polypropylene', 'plastic pyrolysis', 'approximately 35 mmol/gplastic hydrogen', '320 mg/gplastic carbon nanotubes']","['The catalytic pyrolysis', 'pyrolysis', 'catalytic pyrolysis mechanism', 'catalytic pyrolysis', 'plastic pyrolysis']","['liquid oil carbon nanotube (CNTs', 'liquid oil', 'main solid product']"
113,10.1016/j.fuproc.2022.107205,Solar pyrolysis of waste plastics with photothermal catalysts for high-value products,"The photothermal catalytic pyrolysis of low-density polyethylene (LDPE) plastics has been investigated with bifunctional photo-thermo catalysts in a novel photothermal reaction system. Six kinds of catalysts were introduced and explored in an in-situ fixed-bed reactor under 500 °C heated by solar simulator. The results indicated that the hydrogen production and jet fuel selectivity of Ni-Ti-Al catalyst were 34 mol/kg and 80% respectively, which were significantly higher than 7 mol/kg and 38% of Ti-Al. Catalysts loaded with Ni exhibited strong selectivity for aromatic hydrocarbon, achieving 49.51% for Ni-Al and 53.46% for Ni-Ti-Al especially. In addition, Ni-Ti-Al led to high-quality filamentous carbon tubes in smaller diameter, which presented high thermal stability and graphitization. Bifunctional catalyst, especially Ni-Ti-Al possesses obvious photothermal catalytic performance, which is ascribed to relaxations of photogenerated inter- and intra-band electrons of plasmonic metal Ni and excellent carriers transfer capability of non-plasmonic semiconductor TiO2. The production of hydrogen and jet fuel from plastic by photothermal catalytic pyrolysis provides an environmentally friendly way for high-value-recycling of large amount of the waste plastics.",1 June 2022,Fuel Processing Technology,"['Ni-Ti-Al', 'Ti-Al', 'Ni-Al', 'Ni', 'TiO2']","['low-density polyethylene', 'LDPE) plastics', 'plastic', 'waste plastics']","['The photothermal catalytic pyrolysis', 'pyrolysis', 'thermal', 'novel photothermal reaction', 'high thermal stability', 'obvious photothermal catalytic performance', 'photothermal catalytic pyrolysis']","['hydrogen production', 'The production']"
114,10.1016/j.proci.2022.06.008,Distinguishing the impact of temperature on iron catalyst during the catalytic-pyrolysis of waste polypropylene,"The catalytic pyrolysis of waste plastics with iron-based catalyst can produce H2 rich gas, liquid oil and carbon nanotube (CNTs) together. While the catalytic pyrolysis mechanism is still unclear, in this study, the catalytic pyrolysis of polypropylene (PP) was explored in depth, and the influence of catalyst and temperature was distinguished. The results indicated that a lower temperature led to the generation of waxes, while a higher temperature promoted the formation of aromatic hydrocarbons when plastic pyrolysis was performed without a catalyst. In addition, a large number of carbon deposits, mainly in the form of spheres, were collected when the temperature was over 800 ℃. These carbon spheres originated from the agglomeration of aromatic hydrocarbons. Once catalysts were introduced, a large amount of liquid oil was transferred into carbon deposits at both lower and higher catalytic temperatures, simultaneously, leading to more light gases releasing, like hydrogen. At a lower temperature (≤ 800 ℃), it was mainly CNTs while carbon spheres are the main solid product at higher temperatures (> 800 ℃). In addition, two different mechanisms of CNTs formation were also concluded that the base-growth model dominated the of generation CNTs at 600 °C whereas the CNTs followed the tip-growth model at 800 ℃. The results show that the optimized temperature for the catalytic process should be around 800 o℃ where approximately 35 mmol/gplastic hydrogen, 50% hydrogen efficiency and over 320 mg/gplastic carbon nanotubes (CNTs) were obtained.",Available online 6 July 2022,Proceedings of the Combustion Institute,['iron-based'],"['waste plastics', 'polypropylene', 'plastic pyrolysis', 'approximately 35 mmol/gplastic hydrogen', '320 mg/gplastic carbon nanotubes']","['The catalytic pyrolysis', 'pyrolysis', 'catalytic pyrolysis mechanism', 'catalytic pyrolysis', 'plastic pyrolysis']","['liquid oil carbon nanotube (CNTs', 'liquid oil', 'main solid product']"
115,10.1016/j.fuproc.2022.107205,Solar pyrolysis of waste plastics with photothermal catalysts for high-value products,"The photothermal catalytic pyrolysis of low-density polyethylene (LDPE) plastics has been investigated with bifunctional photo-thermo catalysts in a novel photothermal reaction system. Six kinds of catalysts were introduced and explored in an in-situ fixed-bed reactor under 500 °C heated by solar simulator. The results indicated that the hydrogen production and jet fuel selectivity of Ni-Ti-Al catalyst were 34 mol/kg and 80% respectively, which were significantly higher than 7 mol/kg and 38% of Ti-Al. Catalysts loaded with Ni exhibited strong selectivity for aromatic hydrocarbon, achieving 49.51% for Ni-Al and 53.46% for Ni-Ti-Al especially. In addition, Ni-Ti-Al led to high-quality filamentous carbon tubes in smaller diameter, which presented high thermal stability and graphitization. Bifunctional catalyst, especially Ni-Ti-Al possesses obvious photothermal catalytic performance, which is ascribed to relaxations of photogenerated inter- and intra-band electrons of plasmonic metal Ni and excellent carriers transfer capability of non-plasmonic semiconductor TiO2. The production of hydrogen and jet fuel from plastic by photothermal catalytic pyrolysis provides an environmentally friendly way for high-value-recycling of large amount of the waste plastics.",1 June 2022,Fuel Processing Technology,"['Ni-Ti-Al', 'Ti-Al', 'Ni-Al', 'Ni', 'TiO2']","['low-density polyethylene', 'LDPE) plastics', 'plastic', 'waste plastics']","['The photothermal catalytic pyrolysis', 'pyrolysis', 'thermal', 'novel photothermal reaction', 'high thermal stability', 'obvious photothermal catalytic performance', 'photothermal catalytic pyrolysis']","['hydrogen production', 'The production']"
116,10.1016/j.jhazmat.2019.121970,Converting polycarbonate and polystyrene plastic wastes intoaromatic hydrocarbons via catalytic fast co-pyrolysis,"Thermochemical conversion of plastic wastes is a promising approach to produce alternative energy-based fuels. Herein, we conducted catalytic fast co-pyrolysis of polycarbonate (PC) and polystyrene (PS) to generate aromatic hydrocarbons using HZSM-5 (Zeolite Socony Mobil-5, hydrogen, Aluminosilicate) as a catalyst. The results indicated that employing HZSM-5 in the catalytic conversion of PC facilitated the synthesis of aromatic hydrocarbons in comparison to the non-catalytic run. A competitive reaction between aromatic hydrocarbons and aromatic oxygenates was observed within the studied temperature region, and catalytic degradation temperature of 700 °C maximized the competing reaction towards the formation of targeted aromatic hydrocarbons at the expense of phenolic products. Catalyst type also played a vital role in the catalytic decomposition of PC wastes, and HZSM-5 with different Si/Al molar ratios produced more aromatic hydrocarbons than HY (Zeolite Y, hydrogen, Faujasite). Regarding the effect of Si/Al molar ration in HZSM-5 on the distribution of monocyclic aromatic hydrocarbons (MAHs), a Si/Al molar ratio of 38 maximized benzene formation with an advanced factor of 5.1. Catalytic fast co-pyrolysis of PC with hydrogen-rich plastic wastes including polypropylene (PP), polyethylene (PE), and polystyrene (PS) favored the production of MAHs, and PS was the most effective hydrogen donor with a ∼2.5-fold increase. The additive effect of MAHs increased at first and then decreased when the PC percentage was elevated from 30 % to 90 %, achieving the maximum value of 32.4 % at 70 % PC.",15 March 2020,Journal of Hazardous Materials,"['Aluminosilicate', 'Si/Al', 'Zeolite']","['plastic wastes', 'polycarbonate', 'polystyrene', 'PC wastes', 'hydrogen-rich plastic wastes', 'polypropylene', 'polyethylene']","['Thermochemical conversion', 'conversion', 'chemical conversion', 'pyrolysis', 'catalytic conversion', 'degradation', 'catalytic degradation temperature']","['alternative energy-based fuels', 'polystyrene', 'phenolic products', 'production']"
117,10.1016/j.jhazmat.2019.121970,Converting polycarbonate and polystyrene plastic wastes intoaromatic hydrocarbons via catalytic fast co-pyrolysis,"Thermochemical conversion of plastic wastes is a promising approach to produce alternative energy-based fuels. Herein, we conducted catalytic fast co-pyrolysis of polycarbonate (PC) and polystyrene (PS) to generate aromatic hydrocarbons using HZSM-5 (Zeolite Socony Mobil-5, hydrogen, Aluminosilicate) as a catalyst. The results indicated that employing HZSM-5 in the catalytic conversion of PC facilitated the synthesis of aromatic hydrocarbons in comparison to the non-catalytic run. A competitive reaction between aromatic hydrocarbons and aromatic oxygenates was observed within the studied temperature region, and catalytic degradation temperature of 700 °C maximized the competing reaction towards the formation of targeted aromatic hydrocarbons at the expense of phenolic products. Catalyst type also played a vital role in the catalytic decomposition of PC wastes, and HZSM-5 with different Si/Al molar ratios produced more aromatic hydrocarbons than HY (Zeolite Y, hydrogen, Faujasite). Regarding the effect of Si/Al molar ration in HZSM-5 on the distribution of monocyclic aromatic hydrocarbons (MAHs), a Si/Al molar ratio of 38 maximized benzene formation with an advanced factor of 5.1. Catalytic fast co-pyrolysis of PC with hydrogen-rich plastic wastes including polypropylene (PP), polyethylene (PE), and polystyrene (PS) favored the production of MAHs, and PS was the most effective hydrogen donor with a ∼2.5-fold increase. The additive effect of MAHs increased at first and then decreased when the PC percentage was elevated from 30 % to 90 %, achieving the maximum value of 32.4 % at 70 % PC.",15 March 2020,Journal of Hazardous Materials,"['Aluminosilicate', 'Si/Al', 'Zeolite']","['plastic wastes', 'polycarbonate', 'polystyrene', 'PC wastes', 'hydrogen-rich plastic wastes', 'polypropylene', 'polyethylene']","['Thermochemical conversion', 'conversion', 'chemical conversion', 'pyrolysis', 'catalytic conversion', 'degradation', 'catalytic degradation temperature']","['alternative energy-based fuels', 'polystyrene', 'phenolic products', 'production']"
